<?xml version="1.0" encoding="UTF-8"?>
<recipe
	xmlns:xsd="http://www.w3.org/2001/XMLSchema"
	xmlns:xsi="http://www.w3.org/2001/XMLSchema-instance"
	xsi:noNamespaceSchemaLocation="3d-recipe.xsd"
	id="24641006006067">
	<title>Lenchen’s Schokoladenkuchen</title>
	<category id="122" parentId="19">
		<name>Backen</name>
	</category>
	<images>
		<image width="420" height="280">
			<author>brutzelstube</author>
			<source>http://static.chefkoch-cdn.de/ck.de/rezepte/2/2464/42942-420x280-fix-lenchen-s-schokoladenkuchen.jpg</source>
		</image>
		<image width="420" height="280">
			<author>Mutschkabras</author>
			<source>http://static.chefkoch-cdn.de/ck.de/rezepte/2/2464/33241-420x280-fix-lenchen-s-schokoladenkuchen.jpg</source>
		</image>
	</images>
	<ingredients portions="16">
		<ingredient name="Butter" amount="200" unit="g"/>
		<ingredient name="Zucker" amount="200" unit="g"/>
		<ingredient name="Schokolade, Blockschokolade" amount="200" unit="g"/>
		<ingredient name="Mehl" amount="120" unit="g"/>
		<ingredient name="Backpulver" amount="0.5" unit="TL"/>
		<ingredient name="Vanillezucker" amount="1" unit="Pkt."/>
		<ingredient name="Ei(er)" amount="4"/>
	</ingredients>
	<direction>
		<times>
			<pre>60</pre>
			<cook>50</cook>
		</times>
		<severity>normal</severity>
		<calories>295</calories>
		<steps>
			<step>Butter und Schokolade im Wasserbad schmelzen.</step>
			<step>Eier trennen.</step>
			<step>Eiweiß steif schlagen.</step>
			<step>Eigelbe, Zucker und Vanillezucker verrühren.</step>
			<step>Geschmolzene Butter-Schokomasse hinzufügen und mischen.</step>
			<step>Mehl mit dem Backpulver in die Masse sieben und zum Schluss die steifen Eiweiße vorsichtig unterheben.</step>
			<step>In eine gut gefettete Form geben.</step>
			<step>Bei 180°Grad 40 – 50 Minuten backen.</step>
		</steps>
	</direction>
	<comments>
		<comment>
			<commentAuthor>
				<name>ClaudiaK43</name>
				<avatar>
					<image width="60" height="60">
						<source>http://static.chefkoch-cdn.de/ck.de/avatar/39a4daaaf3c439939466d8c582de8c18-60fix.jpg</source>
					</image>
				</avatar>
				<userLevel>1</userLevel>
			</commentAuthor>
			<date>2012-04-17T09:20:47</date>
			<isHelpful>true</isHelpful>
			<content>Kann mir jemand sagen welche Größe die Form bei diesem Rezpet haben muss?</content>
			<replies>
				<comment>
					<author>
						<name>esmiralda83</name>
						<avatar>
							<image width="60" height="60">
								<source>http://static.chefkoch-cdn.de/ck.de/avatar/39a4daaaf3c439939466d8c582de8c18-60fix.jpg</source>
							</image>
						</avatar>
						<userLevel>1</userLevel>
					</author>
					<date>2012-05-09T11:22:47</date>
					<isHelpful>false</isHelpful>
					<content>Ich nehme immer ne 26er Form! Klappt super!</content>
					<replies></replies>
				</comment>
			</replies>
		</comment>
	</comments>
</recipe>
